{
  "$schema": "https://json-schema.org/draft/2020-12/schema",
  "title": "obs.artifact_trust.v1",
  "type": "object",
  "additionalProperties": false,
  "required": ["schema_version", "raw_ref", "content_class", "trust_level", "agent_instruction_policy", "secret_scan", "prompt_injection_scan", "data_quality"],
  "properties": {
    "schema_version": {"type": "string", "enum": ["obs.artifact_trust.v1"]},
    "raw_ref": {"type": "string"},
    "content_class": {
      "type": "string",
      "enum": [
        "log",
        "journal",
        "domain_event",
        "config",
        "telemetry",
        "trace",
        "metric_series",
        "service_state",
        "process_snapshot",
        "manifest",
        "evidence_index",
        "window",
        "context",
        "summary",
        "artifact",
        "binary",
        "recorder_marker",
        "recorder_signal_samples",
        "recorder_status",
        "recorder_incident",
        "recorder_frozen_window",
        "recorder_marker_result",
        "loss_report",
        "trigger_event",
        "dataset_manifest"
      ]
    },
    "trust_level": {
      "type": "string",
      "enum": ["trusted_system", "trusted_adc_generated", "untrusted_target_text", "untrusted_user_provided_text", "opaque_artifact"]
    },
    "agent_instruction_policy": {"type": "string", "enum": ["treat_as_data_only", "treat_as_event_marker_only"]},
    "secret_scan": {
      "type": "object",
      "additionalProperties": false,
      "required": ["status", "redaction_applied", "suspected_secret_count"],
      "properties": {
        "status": {"type": "string", "enum": ["scanned"]},
        "redaction_applied": {"type": "boolean"},
        "suspected_secret_count": {"type": "integer"}
      }
    },
    "prompt_injection_scan": {
      "type": "object",
      "additionalProperties": false,
      "required": ["status", "markers", "severity"],
      "properties": {
        "status": {"type": "string", "enum": ["scanned"]},
        "markers": {"type": "array", "items": {"type": "string"}},
        "severity": {"type": "string", "enum": ["none", "low", "medium", "high"]}
      }
    },
    "data_quality": {"$ref": "obs.data_quality.v1.schema.json"}
  }
}
