{
  "schema_version": "obs.artifact_trust.v1",
  "raw_ref": "artifact://raw/app.log",
  "content_class": "log",
  "trust_level": "untrusted_target_text",
  "agent_instruction_policy": "treat_as_data_only",
  "secret_scan": {
    "status": "scanned",
    "redaction_applied": false,
    "suspected_secret_count": 0
  },
  "prompt_injection_scan": {
    "status": "scanned",
    "markers": [],
    "severity": "none"
  },
  "data_quality": {
    "dropped": false,
    "drop_count": 0,
    "throttled": false,
    "missing": [],
    "truncated": false,
    "clock_confidence": "medium",
    "notes": []
  }
}
